Sheet: Sheet1
A1: FPGA PIN | B1: ARTY PIN | C1: DAUGHTER PIN | D1: CHIP NAME | E1: CHIP PIN | F1: FUNCTION
A2: L13 | B2: IO0 | C2: SV2 (15) | D2: U7 (ADC) | E2: CNV (24) | F2: ADC CNV
A3: N13 | B3: IO1 | C3: SV2 (13) | D3: U7 (ADC) | E3: SCK (41) | F3: ADC SCK
A4: L16 | B4: IO2 | C4: SV2 (11) | D4: U7 (ADC) | E4: SDO1 (27) | F4: ADC SDO Channel 0
A5: T13 | B5: IO29 | C5: SV2 (10) | D5: U7 (ADC) | E5: SDO2 (29) | F5: ADC SDO Channel 1
D6: U7 (ADC) | E6: AIN0+ | F6: ADC Analog Input Channel 0
A9: R14 | B9: IO3 | C9: SV2 (9) | D9: U0, U1 (DAC) | E9: LDAC (21) | F9: DAC LDAC Channel 0 and 1 | G9: Channels
A10: T14 | B10: IO4 | C10: SV2 (7) | D10: U0, U1 (DAC) | E10: CS (8) | F10: DAC CS Channel 0 and 1
A11: R16 | B11: IO5 | C11: SV2 (5) | D11: U0, U1 (DAC) | E11: CLK (9) | F11: DAC CLK Channel 0 and 1
A12: R17 | B12: IO6 | C12: SV2 (3) | D12: U0 (DAC) | E12: SDI (10) | F12: DAC SDI Channel 0
A13: T12 | B13: IO30 | C13: SV2 (8) | D13: U1 (DAC) | E13: SDI (10) | F13: DAC SDI Channel 1
A15: V17 | B15: IO7 | C15: SV2 (1) | D15: U20, U21, U22 (DAC) | E15: LDAC (21) | F15: DAC LDAC chip1, chip2, chip3 | G15: Row selectors
A16: R15 | B16: IO8 | C16: SV1 (8) | D16: U20 (DAC) | E16: CS (8) | F16: DAC CS chip1
A17: T15 | B17: IO9 | C17: SV1 (7) | D17: U21 (DAC) | E17: CS (8) | F17: DAC CS chip2
A18: H16 | B18: IO10 | C18: SV1 (6) | D18: U22 (DAC) | E18: CS (8) | F18: DAC CS chip3
A19: H17 | B19: IO11 | C19: SV1 (5) | D19: U20, U21, U22 (DAC) | E19: CLK (9) | F19: DAC CLK chip1, chip2, chip3
A20: K14 | B20: IO12 | C20: SV1 (4) | D20: U20, U21, U22 (DAC) | E20: SDI (10) | F20: DAC SDI chip1, chip2, chip3
A22: G16 | B22: IO13 | C22: SV1 (3) | D22: U23 (DAC) | E22: LDAC (21) | F22: DAC LDAC | G22: Bias
A23: U11 | B23: IO26 | C23: SV2 (16) | D23: U23 (DAC) | E23: CS (8) | F23: DAC CS
A24: T11 | B24: IO27 | C24: SV2 (14) | D24: U23 (DAC) | E24: CLK (9) | F24: DAC CLK
A25: R11 | B25: IO28 | C25: SV2 (12) | D25: U23 (DAC) | E25: SDI (10) | F25: DAC SDI

Sheet: Measurements
A1: DAC U0 | D1: Address | E1: DAUGHTER PIN | F1: Voltage | G1: Consumption | H1: Loopback with ADC
A2: Data | B2: 0000000000000000 | C2: 0 | D2: A | E2: P$51 | F2: 0 | H2: If connected to ADC modifies output of ADC U0 from 0.125 to 0.4 because the ADC input is connected to the RFEBB of U0
B3: 0000000000000000 | C3: 0 | D3: B | E3: - | F3: -
B4: 0000000000000000 | C4: 0 | D4: C | E4: P$47 | F4: 0
B5: 0000000000000000 | C5: 0 | D5: D | E5: P$45 | F5: 0.20699999999999999 | G5: 0.08
B7: 0001000000000000 | C7: 4096 | D7: A | E7: P$51 | F7: 0.156
B8: 0001000000000000 | C8: 4096 | D8: B
B9: 0001000000000000 | C9: 4096 | D9: C | E9: P$47 | F9: 0.156
B10: 0001000000000000 | C10: 4096 | D10: D | E10: P$45 | F10: 0.36299999999999999
B12: 0010000000000000 | C12: 8192 | D12: A | E12: P$51 | F12: 0.312
B13: 0010000000000000 | C13: 8192 | D13: B
B14: 0010000000000000 | C14: 8192 | D14: C | E14: P$47 | F14: 0.312
B15: 0010000000000000 | C15: 8192 | D15: D | E15: P$45 | F15: 0.51900000000000002
B17: 1111111111111111 | C17: 65535 | D17: A | E17: P$51 | F17: 2.492
B18: 1111111111111111 | C18: 65535 | D18: B
B19: 1111111111111111 | C19: 65535 | D19: C | E19: P$47 | F19: 2.4910000000000001
B20: 1111111111111111 | C20: 65535 | D20: D | E20: P$45 | F20: 2.581 | G20: 0.03
A22: DAC U1
A23: Data | B23: 0000000000000000 | C23: 0 | D23: A | E23: P$43 | F23: 0
B24: 0000000000000000 | C24: 0 | D24: B | E24: P$41 | F24: -1.716
B25: 0000000000000000 | C25: 0 | D25: C | E25: P$39 | F25: 0
B26: 0000000000000000 | C26: 0 | D26: D | E26: P$37 | F26: 0
B28: 0001000000000000 | C28: 4096 | D28: A | E28: P$43 | F28: 0.156
B29: 0001000000000000 | C29: 4096 | D29: B | E29: P$41 | F29: -1.679
B30: 0001000000000000 | C30: 4096 | D30: C | E30: P$39 | F30: 0.156
B31: 0001000000000000 | C31: 4096 | D31: D | E31: P$37 | F31: 0.156
B33: 0010000000000000 | C33: 8192 | D33: A | E33: P$43 | F33: 0.312
B34: 0010000000000000 | C34: 8192 | D34: B | E34: P$41 | F34: -1.6279999999999999
B35: 0010000000000000 | C35: 8192 | D35: C | E35: P$39 | F35: 0.312
B36: 0010000000000000 | C36: 8192 | D36: D | E36: P$37 | F36: 0.312
B38: 1111111111111111 | C38: 65535 | D38: A | E38: P$43 | F38: 2.496
B39: 1111111111111111 | C39: 65535 | D39: B | E39: P$41 | F39: 1.7749999999999999
B40: 1111111111111111 | C40: 65535 | D40: C | E40: P$39 | F40: 2.496
B41: 1111111111111111 | C41: 65535 | D41: D | E41: P$37 | F41: 2.496
A43: DAC U20
A44: Data | B44: 0000000000000000 | C44: 0 | D44: A | E44: P$32 | F44: 0
B45: 0000000000000000 | C45: 0 | D45: B | E45: P$30 | F45: 0
B46: 0000000000000000 | C46: 0 | D46: C | E46: P$28 | F46: 1E-3
B47: 0000000000000000 | C47: 0 | D47: D | E47: P$26 | F47: 1E-3
B49: 0001000000000000 | C49: 4096 | D49: A | E49: P$32 | F49: 0.156
B50: 0001000000000000 | C50: 4096 | D50: B | E50: P$30 | F50: 0.156
B51: 0001000000000000 | C51: 4096 | D51: C | E51: P$28 | F51: 0.157
B52: 0001000000000000 | C52: 4096 | D52: D | E52: P$26 | F52: 0.157
B54: 0010000000000000 | C54: 8192 | D54: A | E54: P$32 | F54: 0.312
B55: 0010000000000000 | C55: 8192 | D55: B | E55: P$30 | F55: 0.312
B56: 0010000000000000 | C56: 8192 | D56: C | E56: P$28 | F56: 0.313
B57: 0010000000000000 | C57: 8192 | D57: D | E57: P$26 | F57: 0.313
B59: 1111111111111111 | C59: 65535 | D59: A | E59: P$32 | F59: 2.4950000000000001
B60: 1111111111111111 | C60: 65535 | D60: B | E60: P$30 | F60: 2.4950000000000001
B61: 1111111111111111 | C61: 65535 | D61: C | E61: P$28 | F61: 2.4950000000000001
B62: 1111111111111111 | C62: 65535 | D62: D | E62: P$26 | F62: 2.4950000000000001
A64: DAC U21
A65: Data | B65: 0000000000000000 | C65: 0 | D65: A | E65: P$24 | F65: 0.20599999999999999
B66: 0000000000000000 | C66: 0 | D66: B | E66: P$22 | F66: 1E-3
B67: 0000000000000000 | C67: 0 | D67: C | E67: P$20 | F67: 1E-3
B68: 0000000000000000 | C68: 0 | D68: D | E68: P$18 | F68: 1E-3
B70: 0001000000000000 | C70: 4096 | D70: A | E70: P$24 | F70: 0.36199999999999999
B71: 0001000000000000 | C71: 4096 | D71: B | E71: P$22 | F71: 0.157
B72: 0001000000000000 | C72: 4096 | D72: C | E72: P$20 | F72: 0.157
B73: 0001000000000000 | C73: 4096 | D73: D | E73: P$18 | F73: 0.157
B75: 0010000000000000 | C75: 8192 | D75: A | E75: P$24 | F75: 0.51800000000000002
B76: 0010000000000000 | C76: 8192 | D76: B | E76: P$22 | F76: 0.313
B77: 0010000000000000 | C77: 8192 | D77: C | E77: P$20 | F77: 0.313
B78: 0010000000000000 | C78: 8192 | D78: D | E78: P$18 | F78: 0.313
B80: 1111111111111111 | C80: 65535 | D80: A | E80: P$24 | F80: 2.581
B81: 1111111111111111 | C81: 65535 | D81: B | E81: P$22 | F81: 2.4950000000000001
B82: 1111111111111111 | C82: 65535 | D82: C | E82: P$20 | F82: 2.4950000000000001
B83: 1111111111111111 | C83: 65535 | D83: D | E83: P$18 | F83: 2.496
A85: DAC U22
A86: Data | B86: 0000000000000000 | C86: 0 | D86: A | E86: P$16 | F86: 1E-3
B87: 0000000000000000 | C87: 0 | D87: B | E87: P$14 | F87: 1E-3
B88: 0000000000000000 | C88: 0 | D88: C | E88: P$12 | F88: 1E-3
B89: 0000000000000000 | C89: 0 | D89: D | E89: P$10 | F89: 1E-3
B91: 0001000000000000 | C91: 4096 | D91: A | E91: P$16 | F91: 0.157
B92: 0001000000000000 | C92: 4096 | D92: B | E92: P$14 | F92: 0.157
B93: 0001000000000000 | C93: 4096 | D93: C | E93: P$12 | F93: 0.157
B94: 0001000000000000 | C94: 4096 | D94: D | E94: P$10 | F94: 0.157
B96: 0010000000000000 | C96: 8192 | D96: A | E96: P$16 | F96: 0.313
B97: 0010000000000000 | C97: 8192 | D97: B | E97: P$14 | F97: 0.313
B98: 0010000000000000 | C98: 8192 | D98: C | E98: P$12 | F98: 0.313
B99: 0010000000000000 | C99: 8192 | D99: D | E99: P$10 | F99: 0.313
B101: 1111111111111111 | C101: 65535 | D101: A | E101: P$16 | F101: 2.4950000000000001
B102: 1111111111111111 | C102: 65535 | D102: B | E102: P$14 | F102: 2.4950000000000001
B103: 1111111111111111 | C103: 65535 | D103: C | E103: P$12 | F103: 2.4950000000000001
B104: 1111111111111111 | C104: 65535 | D104: D | E104: P$10 | F104: 2.496
A106: DAC U23
A107: Data | B107: 0000000000000000 | C107: 0 | D107: A | E107: P$8 | F107: -2.6269999999999998
B108: 0000000000000000 | C108: 0 | D108: B | E108: P$6 | F108: -2.2519999999999998
B109: 0000000000000000 | C109: 0 | D109: C | E109: P$4 | F109: -2.6379999999999999
B110: 0000000000000000 | C110: 0 | D110: D | E110: P$2 | F110: -2.6339999999999999
B112: 0001000000000000 | C112: 4096 | D112: A | E112: P$8 | F112: -2.3410000000000002
B113: 0001000000000000 | C113: 4096 | D113: B | E113: P$6 | F113: -1.966
B114: 0001000000000000 | C114: 4096 | D114: C | E114: P$4 | F114: -2.351
B115: 0001000000000000 | C115: 4096 | D115: D | E115: P$2 | F115: -2.3479999999999999
B117: 0010000000000000 | C117: 8192 | D117: A | E117: P$8 | F117: -2.0539999999999998
B118: 0010000000000000 | C118: 8192 | D118: B | E118: P$6 | F118: -1.679
B119: 0010000000000000 | C119: 8192 | D119: C | E119: P$4 | F119: -2.0649999999999999
B120: 0010000000000000 | C120: 8192 | D120: D | E120: P$2 | F120: -2.0609999999999999
B122: 1111111111111111 | C122: 65535 | D122: A | E122: P$8 | F122: 1.952
B123: 1111111111111111 | C123: 65535 | D123: B | E123: P$6 | F123: 2.1059999999999999
B124: 1111111111111111 | C124: 65535 | D124: C | E124: P$4 | F124: 1.944
B125: 1111111111111111 | C125: 65535 | D125: D | E125: P$2 | F125: 1.946

Sheet: Consumption
A1: DAC Data (Address 00) | B1: Consumption (A)
A2: 65535 | B2: 0.03
A3: 53247 | B3: 0.02
A4: 26863 | B4: 0.06
A5: 32767 | B5: 0.08
A6: 0 | B6: 7.0000000000000007E-2

Sheet: Test1
A1: TEST 1 | B1: Loopback? | C1: No
A2: DAC | B2: Address | C2: Data (HEX) | D2: Daughter PIN | E2: Voltage | J2: Dinamic Range of the amplifiers
A3: U0 | B3: B | C3: 9355 | D3: P$49 | E3: 0 | J3: MAX | K3: 4.04
A4: U0 | B4: A | C4: FFFF | D4: P$51 | E4: 2.4940000000000002 | J4: MIN | K4: -0.92500000000000004
A6: TEST 2 | B6: Loopback? | C6: Yes | J6: Accepted range for the input of the ADC
A7: DAC | B7: Address | C7: Data (HEX) | D7: Daughter PIN | E7: Voltage | J7: MAX | K7: VREFOUT1 | L7: 1.0980000000000001
A8: U0 | B8: B | C8: 9355 | D8: P$49 | E8: 1.806 | J8: MIN | K8: -VREFOUT1 | L8: -1.0980000000000001
A9: U0 | B9: A | C9: FFFF | D9: P$51 | E9: 1.806
A11: Component | B11: PIN | C11: Voltage
A12: OPAMP (U4) | B12: IN2+ (5) | C12: 1.8080000000000001
A13: OPAMP (U4) | B13: OUT2 (7) | C13: -4.0490000000000004
A14: OPAMP (U4) | B14: IN1+ (3) | C14: 2.0819999999999999
A15: OPAMP (U4) | B15: OUT1 (1) | C15: 4.0380000000000003
A16: ADC (U7) | B16: AIN+1 (14) | C16: 4.04
A18: ADC Reading | B18: Bin | C18: Meaning | D18: Conversion
A19: 3FFF | B19: 11111111111111 | C19: 16383 | D19: =RC[-1]*1.098/32767 -> 0.54898324533829768 | E19: It should be 32768, or 7FFF
A21: TEST 3 | B21: Loopback? | C21: Yes
A22: DAC | B22: Address | C22: Data (HEX) | D22: Daughter PIN | E22: Voltage
A23: U0 | B23: B | C23: 9355 | D23: P$49 | E23: 0
A24: U0 | B24: A | C24: 0 | D24: P$51 | E24: 0
A26: Component | B26: PIN | C26: Voltage
A27: OPAMP (U4) | B27: IN2+ (5)
A28: OPAMP (U4) | B28: OUT2 (7)
A29: OPAMP (U4) | B29: IN1+ (3)
A30: OPAMP (U4) | B30: OUT1 (1) | C30: -0.92500000000000004
A31: ADC (U7) | B31: AIN+1 (14) | C31: -0.92500000000000004
A33: ADC Reading (hex) | B33: Bin | C33: Dec | D33: Conversion
A34: dc88 | B34: 1101110010001000 | C34: -9080 | D34: =RC[-1]*1.098/32767 -> -0.30426465651417584
A36: TEST 4 | B36: Loopback? | C36: Yes
A37: DAC | B37: Address | C37: Data (HEX) | D37: Daughter PIN | E37: Voltage
A38: U0 | B38: B | C38: 9355 | D38: P$49 | E38: 4.3999999999999997E-2
A39: U0 | B39: A | C39: 600 | D39: P$51 | E39: 4.3999999999999997E-2
A41: Component | B41: PIN | C41: Voltage
A42: OPAMP (U4) | B42: IN2+ (5)
A43: OPAMP (U4) | B43: OUT2 (7)
A44: OPAMP (U4) | B44: IN1+ (3)
A45: OPAMP (U4) | B45: OUT1 (1) | C45: 0.38
A46: ADC (U7) | B46: AIN+1 (14) | C46: 0.38
A48: ADC Reading (hex) | B48: Bin | C48: Dec | D48: Conversion | E48: x2
A49: 1741 | B49: 001011101000001 | C49: 5953 | D49: =RC[-1]*1.098/32767 -> 0.1994810022278512 | E49: =RC[-1]*2 -> 0.3989620044557024
A50: 18bb | B50: 001100010111011 | C50: 6331 | D50: =RC[-1]*1.098/32767 -> 0.21214752647480697
A51: 1a5b | B51: 001101001011011 | C51: 6747 | D51: =RC[-1]*1.098/32767 -> 0.22608740501113928
A53: TEST 4 | B53: Loopback? | C53: Yes
A54: DAC | B54: Address | C54: Data (HEX) | D54: Daughter PIN | E54: Voltage
A55: U0 | B55: B | C55: 9355 | D55: P$49 | E55: 4.3999999999999997E-2
A56: U0 | B56: A | C56: 680 | D56: P$51 | E56: 4.3999999999999997E-2
A58: Component | B58: PIN | C58: Voltage
A59: OPAMP (U4) | B59: IN2+ (5)
A60: OPAMP (U4) | B60: OUT2 (7)
A61: OPAMP (U4) | B61: IN1+ (3)
A62: OPAMP (U4) | B62: OUT1 (1) | C62: 0.83099999999999996
A63: ADC (U7) | B63: AIN+1 (14) | C63: 0.83099999999999996
A65: ADC Reading (hex) | B65: Bin | C65: Dec | D65: Conversion | E65: x2
A66: 315d | B66: 0011000101011101 | C66: 12637 | D66: =RC[-1]*1.098/32767 -> 0.42345731986449786 | E66: =RC[-1]*2 -> 0.84691463972899572
A67: 3231 | B67: 0011001000110001 | C67: 12849 | D67: =RC[-1]*1.098/32767 -> 0.4305612964262826
A68: 3113 | B68: 0011000100010011 | C68: 12563 | D68: =RC[-1]*1.098/32767 -> 0.42097762993255411
A70: TEST 4 | B70: Loopback? | C70: Yes
A71: DAC | B71: Address | C71: Data (HEX) | D71: Daughter PIN | E71: Voltage
A72: U0 | B72: B | C72: 9355 | D72: P$49 | E72: 5.0999999999999997E-2
A73: U0 | B73: A | C73: 700 | D73: P$51 | E73: 5.0999999999999997E-2
A75: Component | B75: PIN | C75: Voltage
A76: OPAMP (U4) | B76: IN2+ (5)
A77: OPAMP (U4) | B77: OUT2 (7)
A78: OPAMP (U4) | B78: IN1+ (3)
A79: OPAMP (U4) | B79: OUT1 (1) | C79: 1.276
A80: ADC (U7) | B80: AIN+1 (14) | C80: 1.276
A82: ADC Reading (hex) | B82: Bin | C82: Dec | D82: Conversion | E82: x2
A83: 3fff | B83: 0011111111111111 | C83: 16383 | D83: =RC[-1]*1.098/32767 -> 0.54898324533829768 | E83: =RC[-1]*2 -> 1.0979664906765954
E84: Seems that it is the max
A87: TEST 5 | B87: Loopback? | C87: Yes
A88: DAC | B88: Address | C88: Data (HEX) | D88: Daughter PIN | E88: Voltage
A89: U0 | B89: B | C89: 9355 | D89: P$49 | E89: 3.5999999999999997E-2
A90: U0 | B90: A | C90: 500 | D90: P$51 | E90: 3.5999999999999997E-2
A92: Component | B92: PIN | C92: Voltage
A93: OPAMP (U4) | B93: IN2+ (5)
A94: OPAMP (U4) | B94: OUT2 (7)
A95: OPAMP (U4) | B95: IN1+ (3)
A96: OPAMP (U4) | B96: OUT1 (1) | C96: -0.52
A97: ADC (U7) | B97: AIN+1 (14) | C97: -0.52
A99: ADC Reading (hex) | B99: Bin | C99: Dec | D99: Conversion | E99: x2
A100: e320 | B100: 1110001100100000 | C100: -7392 | D100: =RC[-1]*1.098/32767 -> -0.24770091860713525 | E100: =RC[-1]*2 -> -0.4954018372142705
A104: TEST 6 | B104: Loopback? | C104: Yes
A105: DAC | B105: Address | C105: Data (HEX) | D105: Daughter PIN | E105: Voltage
A106: U0 | B106: B | C106: 9355 | D106: P$49 | E106: 3.2000000000000001E-2
A107: U0 | B107: A | C107: 450 | D107: P$51 | E107: 3.2000000000000001E-2
A109: Component | B109: PIN | C109: Voltage
A110: OPAMP (U4) | B110: IN2+ (5)
A111: OPAMP (U4) | B111: OUT2 (7)
A112: OPAMP (U4) | B112: IN1+ (3)
A113: OPAMP (U4) | B113: OUT1 (1) | C113: -0.92500000000000004
A114: ADC (U7) | B114: AIN+1 (14) | C114: -0.92500000000000004
A116: ADC Reading (hex) | B116: Bin | C116: Dec | D116: Conversion | E116: x2
A117: dc52 | B117: 1101110001010010 | C117: -9134 | D117: =RC[-1]*1.098/32767 -> -0.30607415997802673 | E117: =RC[-1]*2 -> -0.61214831995605345

Sheet: ADC Configuration
A1: AIN1- (13) | B1: REFOUT 1 (22) | C1: REF (8)
A2: 0 | B2: 1.0980000000000001 | C2: 2.0979999999999999

Sheet: Triangular function parameters
A1: DAC min (DEC) | B1: 1430
A2: DAC max (DEC) | B2: 1700
A3: Amplitude (DEC) | B3: =R[-1]C-R[-2]C -> 270
A4: Time between samples (s) | B4: 1.9999999999999999E-6
A5: Period samples | B5: 256
A6: Frequency (Hz) | B6: =1/(R[-2]C*R[-1]C) -> 1953.125
A7: Max increment between samples | B7: 10
A8: Increment percentage | B8: 10
A9: Final increment (DEC) | B9: =R[-1]C/100*R[-2]C -> 1
A10: Final total increment (DEC) | B10: =R[-1]C*R[-5]C -> 256
A11: Offset (DEC) | B11: 1435
A12: Final Min Value (DEC) | B12: =R[-1]C -> 1435
A13: Final Max Value (DEC) | B13: =R[-2]C+R[-3]C -> 1691